statement,question,correct_answer_text
"Ɔkwan a worefa so no, ɛrenni wo yie.",What does 'ɛrenni wo yie' mean?,The path you are taking will not lead to success.
Me nsa aka me nan.,What is the speaker's physical state?,I am shocked or surprised.
Awo Yaa bo afuw.,What is Awo Yaa's reaction?,Awo Yaa is extremely furious.
"Wonyɛ no saa a, ɔbɛkyerɛ wo ne ho.",What does 'ɔbɛkyerɛ wo ne ho' mean?,He will show you his true colors or prove his power to you.
"Mmarima yi, wɔn ano yɛ de.",What is being said about the men?,They are very good at persuasion or sweet-talking people.
"Wose ɔyɛ wo yere, nanso ɔrewe wo sika.",What is the woman doing?,She is spending your money extravagantly or wasting it.
Awo Yaa yɛ obi a ɔnim afutuo.,What does 'ɔnim afutuo' mean?,She knows how to give counseling or advice.
"Sɛ wobɛda ɔman no ano a, ɛsɛ sɛ woyɛ ntease.",What does 'wobɛda ɔman no ano' mean?,You will become a leader or the representative of the people.
Ne nsa akura adwuma no mu.,What is the person doing with the work?,He has fully engaged or committed himself to the task.
Ɔde ne ho ato me so.,What has the person done?,He has entrusted his life or problems entirely to me.
"Wonyinii a, wobɛhu.",What does this mean?,"When you mature or gain experience, you will understand the reality of life."
"Nipa yi, ɔpɛ sɛ ɔyɛ n'adeɛ.",What does 'ɔyɛ n'adeɛ' mean?,"He wants to do things his own way, often ignoring others."
"Ɔbarima yi, ne nsa bɔ fam dodo, ɔmmɛyɛ hwee a ɛbɛma ne fie afa yiye.",What is being said about the man's behavior?,He is extremely lazy and lacks ambition to improve his family's welfare.
"M'ani abere wo ho, enti hwɛ yiye na wopɛ nea wobɛka.",What does the speaker mean by 'M'ani abere wo ho'?,"The speaker is extremely angry, annoyed, or impatient with the person."
"Yɛnni nsuo nnom, nanso nipa yi repɛ sɛ ɔfa akwantu a ɛnyɛ.",What is the speaker implying about the person's plan?,The person is attempting an impossible or fruitless venture.
"Nipa a ɔwɔ m’akyi no, ɔyɛ obi a ne ho yɛ duru.",What is the status of the person being described?,"The person is highly respected, influential, or a person of substance."
Ɛsɛ sɛ yɛbɔ mpaeɛ na Onyankopɔn ama yɛn aso ate nka.,What does the speaker mean by 'ama yɛn aso ate nka'?,They are asking for God to make them hear or understand something important.
"Wo nsa akokwaw, enti gyae adwuma a woreyɛ yi ansa na woahwere wo ho.",What does 'Wo nsa akokwaw' signify in this context?,"The person is inexperienced, clumsy, or incompetent at the task."
"Nipa bɔne yi, yɛnni nea yɛbɛka, ne ti akye.",What has happened to the person?,"The person has become stubborn, defiant, or hardened in their bad ways."
Ɔbarima no buu n'anim guu fam bere a wɔkaa nokware no.,What was the man's reaction?,He felt deeply ashamed or disgraced by the truth.
"Yɛnni nni bi, nanso wobɛdi ka a ɛnyɛ wo dea.",What is the warning about?,The person is being warned not to take on debts or responsibilities that are not theirs.
"W'anom yɛ dɛ dodo, nti yɛntumi nnye wo di.",What is the problem with the person?,The person is too flattering or deceptive with their words.
"W'ani sɔ me nsa, entumi nnyina ha.",What is the speaker expressing?,The speaker is finding the person annoying or a hindrance to their progress.
"Sɛ wopɛ akwantu a, wopɛ nea ɛyɛ.",What is the advice given?,You should ensure that your plans or path are morally sound or legitimate.
"Wɔde sika no asiesie no yiye, nanso ne koma nni mu.",What does 'ne koma nni mu' mean?,"The person is not sincere, committed, or passionate about what they are doing."
Ɔhene no de n'ani kyerɛɛ ɔbarima no.,What did the King do?,The King paid close attention to or showed special interest in the man.
"Nipa yi nni akwantu, ne nan yɛ dɛw.",What is implied by 'ne nan yɛ dɛw'?,"The person is restless, always wandering, or inclined to travel frequently."
Mɛhwɛ sɛ mɛbɔ n’asomdwoeɛ.,What is the speaker threatening to do?,"To disturb, ruin, or destroy the person's peace of mind."
"Wode wo nsa ama me a, ɛno ne sɛ wopɛ me yiyedie.",What does 'de wo nsa ma me' mean here?,"To offer support, help, or express genuine solidarity with someone."
"Yɛnni ntɛm nni nni, nanso nipa yi repɛ sɛ ɔdi n’ano nni.",What is the person doing?,"They are talking too much, bragging, or gossiping uncontrollably."
"Ɔbarima no nni adwene, ne ti yɛ kwa.",What is the character describing?,"The man is foolish, thoughtless, or lacks wisdom."
"Me nsa nni hwee, nti mennya sika a mɛde aboa wo.",What is the speaker's situation?,The speaker has no money and is financially helpless.
"Wo nsa keka wo nti, wode wo nsa gu n’adeɛ so.",What is the person being accused of?,They are stealing or misappropriating someone else's property.
"W’ani abue, na w’adwene akye.",What has happened to the person?,"They have become enlightened, wise, or matured in their thinking."
"Ɔdɔ yɛ owu, na obiara ntumi nni no fɛw.",What is the cultural stance on love in the movie?,"Love is a powerful, serious, and sometimes overwhelming force that shouldn't be trifled with."
"Sɛ wote nea obi aka no, ɛnne sɛ w’ani sɔ.",What does 'w'ani sɔ' mean in this context?,"You approve of, appreciate, or are satisfied with what was said."
"Me nsa aka nneɛma pii, nti menyɛ obi a ɔte hɔ ara kwa.",What is the speaker boasting about?,"They are experienced, have accomplished much, and are not idle."
